{
  "response_type": "door_one_workbench_lm_response",
  "input_stream_id": "STR:synthetic_workbench_v1:ch0:voltage:arb:256",
  "observations": [
    " "
  ],
  "questions": [
    " "
  ],
  "non_claims": [
    "Not canon authority.",
    "Not runtime authority.",
    "Not truth closure.",
    "Not same-object closure.",
    "Not identity closure.",
    "Not promotion authority."
  ],
  "authority_posture": {
    "read_side_only": true,
    "canon_authority": false,
    "runtime_authority": false,
    "truth_closure": false,
    "identity_closure": false,
    "same_object_closure": false,
    "promotion_authority": false
  }
}
